Middle Earth --> m --> Dwarf --> Óin,"Blaze, Breeze, Dancing, Dawn, Defiant, Eagle, Fair, Feather, Gentle, Glorious, Great, Just, Legendary, Moonlight, Mustang, Oin, Peaceful, Pious, Precious, Running, Shadow, Shining, Sky, Splendid, Star, Swift, The, Thundering, Wild, Wolf"
Middle Earth --> m --> Elf,ALL
Middle Earth --> m --> Elf --> Aegnor,"Aegnor, Chivalrous, Pious, Resilient, The, Wise"
Middle Earth --> m --> Elf --> Amdír,"Amdir, Dawn, Graceful, Noble, Peaceful, Serene, Shining, Star, The, Whisper"
Middle Earth --> m --> Elf --> Amras,"Amras, Dream, Echo, Falling, Harbor, Heroic, Mountain, Peaceful, Perceptive, River, Running, Swift, The, Valiant, Wolf"
Middle Earth --> m --> Elf --> Amrod,"Amrod, Daring, Enigmatic, Fair, Indomitable, Luminous, Resilient, River, Sublime, Swift, The"
Middle Earth --> m --> Elf --> Amroth,"Amroth, Falls, Gallant, Hawk, Heart, Just, Proud, Singing, Soaring, Stoic, Strong, Thunder, Thundering"
Middle Earth --> m --> Elf --> Angrod,"Angrod, Defiant, Falling, Rain, Wandering, Wolf"
Middle Earth --> m --> Elf --> Annael,"Annael, Charismatic, Glow, Little, Morning, Otter, Pious, Regal, Resolute, Rock, Saint, Splendid, Strong, The"
Middle Earth --> m --> Elf --> Aranwë,"Aranwe, Autumn, Cedar, Cruel, Gallant, Gentle, Just, Mist, Morning, Poetic, Resplendent, Sky, Spirit, Stoic, Tree"
Middle Earth --> m --> Elf --> Argon,"Argon, Blaze, Canyon, Chivalrous, Daring, Empowered, Formidable, Night, Starry, Sunlit, Swift, The, Valiant"
Middle Earth --> m --> Elf --> Arminas,"Arminas, Dawn, Empowered, Mesa, Peaceful, Radiant, Sacred, The"
Middle Earth --> m --> Elf --> Beleg,"Beleg, Brook, Chivalrous, Conqueror, Cuthalion, Glow, Morning, Running, Victorious"
Middle Earth --> m --> Elf --> Caranthir,"Caranthir, Chivalrous, Cruel, Empowered, Laughing, Lionheart, Terrible, The, Waters"
Middle Earth --> m --> Elf --> Celeborn,"Brilliant, Celeborn, Deer, Gracious, Resolute, Running, The, Wise"
Middle Earth --> m --> Elf --> Celebrimbor,"Celebrimbor, Magnificent, Swift, The, Wind"
Middle Earth --> m --> Elf --> Celegorm,"Blaze, Celegorm, Just, Kind, Swift"
Middle Earth --> m --> Elf --> Curufin,"Cruel, Curufin, Dancing, Doe, Feather, Fire, Fox, Gallant, Graceful, Imposing, Indomitable, Quiet, Singing, Swift, The, Thunder"
Middle Earth --> m --> Elf --> Círdan,"Brave, Cirdan, Dancing, Harmonious, Star, The"
Middle Earth --> m --> Elf --> Daeron,"Daeron, Mesa, Sacred"
Middle Earth --> m --> Elf --> Denethor,"Blaze, Denethor, Dreamer, Feathered, Formidable, Precious, Quiet, Storm, Swift, Transcendent"
Middle Earth --> m --> Elf --> Ecthelion,"Conscientious, Ecthelion, Formidable, Fountain, Magnificent, Owl, Path, Radiant, Stone, Strong, The, Whispering, of, the"
Middle Earth --> m --> Elf --> Edrahil,"Distinguished, Doe, Edrahil, Empowered, Glorious, Graceful, Rising, Sun, Tenacious, The"
Middle Earth --> m --> Elf --> Egalmoth,"Courageous, Dreamer, Egalmoth, Feathered, Radiant, The, Wise"
Middle Earth --> m --> Elf --> Elemmakil,"Adroit, Bear, Brilliant, Brook, Elemmakil, River, Running, Stone, Swift"
Middle Earth --> m --> Elf --> Elmo,"Eagle, Elmo, Feather, Forest, Night, Rock, Silent, Singing, Splendid, Starry, Strong, Thunder"
Middle Earth --> m --> Elf --> Enel,"Enel, Formidable, Gallant, Lark, Night, Singing, Starry, Terrible, The, Wandering, Wolf"
Middle Earth --> m --> Elf --> Enerdhil,"Bear, Dew, Eagle, Enerdhil, Exalted, Feather, Feathered, Golden, Just, Morning, Resolute, Running, Saint, Skilled, Song, Spirited, Swift, The"
Middle Earth --> m --> Elf --> Erestor,"Bear, Bold, Conqueror, Empowered, Erestor, Laughing, Little, Path, Stone, Sun, The, Transcendent"
Middle Earth --> m --> Elf --> Eöl,"Autumn, Dawn, Dream, Empirical, Eol, Mountain, Peaceful, River, Running, Singing, Sky, Swift, Terrible, The, Thunder, Wind"
Middle Earth --> m --> Elf --> Finarfin,"Chivalrous, Conqueror, Dancing, Finarfin, Fire, Fox, Radiant, Running, Serene, Smiling, The, Valley, Wolf"
Middle Earth --> m --> Elf --> Fingolfin,"Audacious, Conqueror, Dew, Echo, Fearless, Fingolfin, Illustrious, Indomitable, Morning, Path, Rising, Silent, Stone, Sun, The, Virtuous, Zealous"
Middle Earth --> m --> Elf --> Fingon,"Bold, Brook, Charismatic, Fingon, Fox, Kind, Laughing, Peaceful, River, Serene, Smiling, Whisper"
Middle Earth --> m --> Elf --> Finrod,"Brook, Feather, Finrod, Glorious, Laughing, Mighty, Swift"
Middle Earth --> m --> Elf --> Finwë,"Blue, Bold, Brilliant, Finwe, Harmonious, Indomitable, Night, Sky, Starry, The"
Middle Earth --> m --> Elf --> Fëanor,"Dreamer, Feanor, Feathered, Legendary, Lionheart, Running, The, Wolf"
Middle Earth --> m --> Elf --> Galadhon,"Dauntless, Galadhon, Glorious, Lark, Lionheart, Mesa, Moon, Resolute, Sacred, Silent, Singing, The"
Middle Earth --> m --> Elf --> Galathil,"Audacious, Brave, Eagle, Fox, Galathil, Lake, Luminous, Owl, Quiet, Radiant, Serene, Sovereign, The, Tranquil, Wandering, Whispering, Wise, Wolf"
Middle Earth --> m --> Elf --> Galdor,"Blue, Brook, Dove, Eloquent, Galdor, Just, Quiet, River, Running, Shining, Singing, Sky, Star, The, Victorious, Whispering"
Middle Earth --> m --> Elf --> Galion,"Adroit, Brave, Falling, Fearless, Galion, Radiant, Snow, Spirit, Tenacious, The, Wandering"
Middle Earth --> m --> Elf --> Gelmir,"Brave, Dauntless, Fox, Gelmir, Glorious, Golden, Horizon, Luminous, Mighty, Noble, Passionate, Peaceful, Radiant, River, Smiling, The, Valiant, Wandering, Wolf"
Middle Earth --> m --> Elf --> Gil-galad,"Compassionate, Dancing, Defiant, Gil-galad, Harbor, Mighty, Peaceful, Pious, Sublime, Tenacious, The, Willow"
Middle Earth --> m --> Elf --> Gildor,"Echo, Gildor, Inglorion, Mountain, Peaceful, River"
Middle Earth --> m --> Elf --> Glorfindel,"Bear, Benevolent, Bison, Brave, Charismatic, Dreamer, Eagle, Feathered, Glorfindel, Golden, Great, Illustrious, Ingenious, Little, Magnanimous, Path, Pious, Quiet, River, Saint, Singing, Stoic, Stone, Sublime, The, Waters"
Middle Earth --> m --> Elf --> Guilin,"Eagle, Feather, Guilin, Majestic, Red, River, Serene, Swift, Whisper, Wolf"
Middle Earth --> m --> Elf --> Gwindor,"Current, Golden, Gwindor, Horizon, Rock, Spirited, Strong, Swift"
Middle Earth --> m --> Elf --> Haldir,"Haldir, Heart, Ingenious, Meadow, Red, Resplendent, Revered, Strong, Sunlit, Wolf"
Middle Earth --> m --> Elf --> Imin,"Eloquent, Forest, Imin, Pine, Resolute, Silent, The, Whispering"
Middle Earth --> m --> Elf --> Ingwion,"Dawn, Dream, Fields, Golden, Ingwion, Jubilant, Moonlight, Mountain, Oak, Peaceful, Shadow, Spirit, Strong, Wandering, Wolf"
Middle Earth --> m --> Elf --> Ingwë,"Brook, Eagle, Golden, Ingwe, Outspoken, Running"
Middle Earth --> m --> Elf --> Legolas,"Audacious, Brave, Eagle, Legolas, Mighty, Outspoken, Resolute, Spirited, The"
Middle Earth --> m --> Elf --> Lenwë,"Adroit, Blaze, Bold, Conscientious, Heroic, Illuminated, Lenwe, Regal, Sky, Strong, Swift, The, Thundering"
Middle Earth --> m --> Elf --> Mablung,"Forest, Gentle, Harbor, Mablung, Peaceful, Resilient, Silent, Spirit, Steadfast, Whispering, Wind"
Middle Earth --> m --> Elf --> Maedhros,"Defiant, Discerning, Empirical, Feathered, Illuminated, Laughing, Lionheart, Maedhros, Moon, Oak, Rising, Song, Songbird, Strong, The"
Middle Earth --> m --> Elf --> Maeglin,"Empowered, Illustrious, Intrepid, Maeglin, The"
Middle Earth --> m --> Elf --> Maglor,"Brave, Feathered, Heart, Illuminated, Laughing, Maglor, Moonlight, Shadow, Sky, Sun"
Middle Earth --> m --> Elf --> Mahtan,"Daring, Gallant, Magnanimous, Mahtan, Outspoken"
Middle Earth --> m --> Elf --> Olwë,"Deer, Glorious, Hawk, Illuminated, Illustrious, Olwe, Quiet, Resilient, Revered, Running, Serenity, Soaring, The"
Middle Earth --> m --> Elf --> Orodreth,"Bear, Doe, Graceful, Orodreth, Stone, Transcendent"
Middle Earth --> m --> Elf --> Oropher,"Autumn, Charismatic, Defiant, Flame, Harbor, Oropher, Path, Peaceful, Poetic, Radiant, Stone, The"
Middle Earth --> m --> Elf --> Orophin,"Bold, Distinguished, Fields, Golden, Laughing, Orophin, Resolute, Resplendent, Rising, Songbird, Strong, Sun"
Middle Earth --> m --> Elf --> Pengolodh,"Breeze, Falcon, Fearless, Gentle, Little, Pengolodh, The"
Middle Earth --> m --> Elf --> Rúmil,"Conscientious, Falcon, Glorious, Just, Laughing, Little, Magnanimous, Otter, Revered, Rumil, Strong, Sun, The"
Middle Earth --> m --> Elf --> Tata,"Majestic, Mighty, Revered, Tata, The"
Middle Earth --> m --> Elf --> Thingol,"Eloquent, Fair, Illustrious, Lark, Oak, Singing, Strong, The, Thingol"
Middle Earth --> m --> Elf --> Thranduil,"Current, Dew, Eagle, Feather, Feathered, Laughing, Morning, Sky, Stoic, Sun, Swift, Thranduil, Virtuous"
Middle Earth --> m --> Elf --> Turgon,"Echo, Falling, Gallant, The, Turgon"
Middle Earth --> m --> Elf --> Voronwë,"Brave, Eloquent, Heroic, Mesa, Night, Sacred, Starry, Sunflower, The, Unyielding, Voronwe"
Middle Earth --> m --> Ent,ALL
Middle Earth --> m --> Ent --> Beechbone,"Beechbone, Charismatic, Glow, Harbor, Morning, Passionate, Peaceful, River, Saint, Swift, Tenacious, The, Transcendent, Victorious"
Middle Earth --> m --> Ent --> Bregalad,"Bregalad, Current, Empirical, Path, Regal, Serene, Stone, Swift, The, Wind"
Middle Earth --> m --> Ent --> Finglas,"Autumn, Blaze, Blue, Canyon, Defiant, Finglas, Flame, Gracious, Quiet, Singing, Sky, Storm, Sunlit, Swift, Thunder"
Middle Earth --> m --> Ent --> Fladrif,"Fladrif, Gentle, Lark, Moon, Quiet, Rain, Rising, Serenity, Singing, Virtuous"
Middle Earth --> m --> Ent --> Treebeard,"Dancing, Dove, Honorable, Mist, Morning, Quiet, Running, Sovereign, The, Thunder, Treebeard, Willow"
Middle Earth --> m --> Half-elf,ALL
Middle Earth --> m --> Half-elf --> Dior,"Brilliant, Cedar, Dior, Laughing, Night, Singing, Starry, Thunder, Tree, Waters"
Middle Earth --> m --> Half-elf --> Elladan,"Discerning, Elladan, Falcon, Falls, Feathered, Little, Pious, Rising, Song, Sun, Thundering, Tranquil, Zealous"
Middle Earth --> m --> Half-elf --> Elrohir,"Bold, Elrohir, Feathered, Gentle, Illustrious, Imposing, Magnificent, Noble, Rain, Song, The"
Middle Earth --> m --> Half-elf --> Elrond,"Charismatic, Elrond, Fields, Golden, Passionate, The"
Middle Earth --> m --> Half-elf --> Elros,"Brook, Elros, Empowered, Resplendent, The, Whispering"
Middle Earth --> m --> Half-elf --> Eluréd,"Audacious, Benevolent, Brook, Dancing, Elured, Fire, Laughing, Majestic, Running, Singing, Sublime, Sun, The, Thunder"
Middle Earth --> m --> Half-elf --> Elurín,"Dancing, Deer, Elurin, Enlightened, Gallant, Glorious, Heroic, Quiet, Running, Saint, Sovereign, Storm, The, Tranquil, Willow"
Middle Earth --> m --> Half-elf --> Eärendil,"Conscientious, Earendil, Sagacious, Steadfast, The, Victorious, Zealous"
Middle Earth --> m --> Half-elf --> Galador,"Distinguished, Enlightened, Galador, The"
Middle Earth --> m --> Hobbit,ALL
Middle Earth --> m --> Hobbit --> Adalbert,"Adalbert, Bolger, Canyon, Dancing, Ingenious, Magnificent, Mist, Morning, Rainbow, Sunlit, Tenacious, The, Visionary"
Middle Earth --> m --> Hobbit --> Adalgar,"Adalgar, Bolger"
Middle Earth --> m --> Hobbit --> Adalgrim,"Adalgrim, Courageous, Dancing, Echo, Fire, Mountain, Rising, Star, The, Took, Unyielding"
Middle Earth --> m --> Hobbit --> Adelard,"Adelard, Bear, Blue, Dancing, Falcon, Flame, Little, Proud, Saint, Sky, Took, Zealous"
Middle Earth --> m --> Hobbit --> Andwise,"Andwise, Bear, Brilliant, Conscientious, Falls, Majestic, Quiet, Roper, Running, Serene, Serenity, The, Thundering, Whisper"
Middle Earth --> m --> Hobbit --> Anson,"Anson, Gallant, Mighty, Resolute, Roper, Tenacious, Terrible, The"
Middle Earth --> m --> Hobbit --> Balbo,"Autumn, Baggins, Balbo, Dove, Dream, Fearless, Feathered, Flame, Great, Laughing, Mist, Morning, Mountain, Quiet, Song, Songbird, Star, The"
Middle Earth --> m --> Hobbit --> Bandobras,"Bandobras, Brilliant, Dancing, Discerning, Falcon, Flame, Heroic, Little, Sky, Thundering, Took"
Middle Earth --> m --> Hobbit --> Basso,"Basso, Boffin, Fair, Saint"
Middle Earth --> m --> Hobbit --> Berilac,"Berilac, Blaze, Brandybuck, Illustrious, Majestic, Serene, Swift, Tenacious, The, Whisper"
Middle Earth --> m --> Hobbit --> Bilbo,"Bilbo, Empowered, Fields, Gardner, Golden, The, Valiant"
Middle Earth --> m --> Hobbit --> Bingo,"Baggins, Bingo, Intrepid"
Middle Earth --> m --> Hobbit --> Blanco,"Autumn, Blanco, Bracegirdle, Cedar, Gentle, Great, Harbor, Illustrious, Intrepid, Mist, Morning, Night, Peaceful, Regal, Serene, Sky, Spirit, Starry, Terrible, The, Tree, Unyielding, Valley, Visionary"
Middle Earth --> m --> Hobbit --> Bob,"Bob, Brook, Dauntless, Inspiring, Just, Meadow, Regal, Sunlit, Whispering"
Middle Earth --> m --> Hobbit --> Bodo,"Bodo, Golden, Horizon, Proudfoot, Shining, Star, Visionary"
Middle Earth --> m --> Hobbit --> Bosco,"Boffin, Bosco, Eagle, Golden, Lionheart"
Middle Earth --> m --> Hobbit --> Bowman,"Bowman, Cotton, Fair, Glow, Illuminated, Just, Morning, Peaceful, Red, River, Sublime, The, Transcendent, Wolf"
Middle Earth --> m --> Hobbit --> Briffo,"Boffin, Briffo, Enlightened, Fox, Ingenious, Quiet, The"
Middle Earth --> m --> Hobbit --> Bruno,"Bison, Bracegirdle, Brave, Bruno, Oak, Strong"
Middle Earth --> m --> Hobbit --> Bucca,"Bucca, Golden, Great, Honorable, Horizon, Inspiring, Moon, Radiant, Running, Silent, Thunder, Valiant"
Middle Earth --> m --> Hobbit --> Buffo,"Boffin, Buffo"
Middle Earth --> m --> Hobbit --> Bungo,"Baggins, Bungo"
Middle Earth --> m --> Hobbit --> Carl,"Brook, Carl, Cotton, Empowered, Laughing, The"
Middle Earth --> m --> Hobbit --> Cotman,"Bison, Brave, Cotman, Empowered, Feathered, Formidable, Morning, Serene, Sky, Star, The, Valley"
Middle Earth --> m --> Hobbit --> Cottar,"Conscientious, Cottar, Discerning, Exalted, The, Victorious"
Middle Earth --> m --> Hobbit --> Dinodas,"Brandybuck, Cedar, Dinodas, Distinguished, Magnanimous, Running, Thunder, Tree"
Middle Earth --> m --> Hobbit --> Doderic,"Brandybuck, Brilliant, Doderic, Empirical, Golden, Horizon, Moonlight, Regal, Shadow, Spirit, The, Wandering"
Middle Earth --> m --> Hobbit --> Dodinas,"Brandybuck, Cedar, Charismatic, Dodinas, Exalted, Fair, Majestic, The, Tree, Visionary, Wise"
Middle Earth --> m --> Hobbit --> Drogo,"Baggins, Bear, Brave, Daring, Drogo, Laughing, Majestic, Quiet, Running, Serenity, Songbird, The"
Middle Earth --> m --> Hobbit --> Dudo,"Baggins, Deer, Dudo, Echo, Indomitable, Running, Silent, The"
Middle Earth --> m --> Hobbit --> Déagol,"Adroit, Breeze, Charismatic, Dauntless, Deagol, Gentle, Glorious, Kind, The, Wandering, Wolf"
Middle Earth --> m --> Hobbit --> Elfstan,"Blaze, Elfstan, Empowered, Fairbairn, Falling, Harmonious, Leaves, River, Swift, The, Unyielding, Wandering, Wolf"
Middle Earth --> m --> Hobbit --> Erling,"Blaze, Current, Eloquent, Enigmatic, Erling, Feather, Greenhand, Harbor, Peaceful, Swift, Terrible, The"
Middle Earth --> m --> Hobbit --> Everard,"Bear, Dancing, Dew, Everard, Fearless, Fire, Harbor, Luminous, Morning, Peaceful, Running, Stone, The, Took"
Middle Earth --> m --> Hobbit --> Falco,"Autumn, Chubb-Baggins, Falco, Gallant, Luminous, Serene, Sky, The, Whisper"
Middle Earth --> m --> Hobbit --> Faramir,"Dancing, Faramir, Feathered, Little, Otter, Sky, Star, Took"
Middle Earth --> m --> Hobbit --> Farmer,"Enigmatic, Fair, Farmer, Maggot, Terrible, The, Wandering, Wolf"
Middle Earth --> m --> Hobbit --> Fastolph,"Bolger, Conscientious, Falcon, Fastolph, Feathered, Little, Mist, Morning, Night, Sky, Starry, Sublime"
Middle Earth --> m --> Hobbit --> Fastred,"Brave, Cedar, Dancing, Enigmatic, Fastred, Feather, Fox, Heart, Honorable, Just, Majestic, Proud, Singing, Smiling, Sublime, Swift, The, Thunder, Tree, Willow"
Middle Earth --> m --> Hobbit --> Ferdinand,"Autumn, Brave, Echo, Ferdinand, Fire, Heart, Ingenious, Invincible, Magnificent, Regal, Rising, Silent, Sky, Stoic, The, Took"
Middle Earth --> m --> Hobbit --> Ferumbras,"Dancing, Echo, Falling, Ferumbras, Flame, Golden, Horizon, I, II, III, Lionheart, Mustang, Radiant, Saint, Sovereign, The, Took, Visionary, Wild"
Middle Earth --> m --> Hobbit --> Filibert,"Bolger, Fair, Filibert, Little, Otter, Shining, Star, The, Visionary"
Middle Earth --> m --> Hobbit --> Flambard,"Benevolent, Blue, Fields, Flambard, Golden, Sky, Sublime, The, Took, Victorious"
Middle Earth --> m --> Hobbit --> Folco,"Boffin, Dancing, Fearless, Folco, Revered, Running, Steadfast, The, Thunder, Willow, Wise"
Middle Earth --> m --> Hobbit --> Fortinbras,"Exalted, Forest, Fortinbras, Harbor, Heroic, I, II, Just, Little, Otter, Peaceful, Regal, River, Running, Silent, Spirited, The, Took, Whispering, Wind, Wolf"
Middle Earth --> m --> Hobbit --> Fosco,"Baggins, Benevolent, Brilliant, Courageous, Echo, Fosco, Laughing, Meadow, Mountain, Path, Stone, Sun, Sunlit, Thunderbird"
Middle Earth --> m --> Hobbit --> Fredegar,"Bolger, Brave, Exalted, Fredegar, Heart, Resilient, Singing, Thunder, Whispering, Wind"
Middle Earth --> m --> Hobbit --> Frodo,"Baggins, Echo, Fearless, Feathered, Frodo, Gallant, Gardner, Graceful, Imposing, Moon, Mountain, Regal, River, Silent, Song, Steadfast, Sunflower, Swift, The"
Middle Earth --> m --> Hobbit --> Gerontius,"Brave, Gerontius, Heart, Moon, Outspoken, Rising, Took"
Middle Earth --> m --> Hobbit --> Gollum,"Dream, Fearless, Gollum, Mountain"
Middle Earth --> m --> Hobbit --> Gorbadoc,"Brandybuck, Dancing, Discerning, Dreamer, Feathered, Gorbadoc, Lark, Moon, Rainbow, Revered, Rising, Singing, The, Thunder, Transcendent"
Middle Earth --> m --> Hobbit --> Gorbulas,"Arrow, Bear, Brandybuck, Gorbulas, Heroic, Little, Ornate, Swift, Unyielding"
Middle Earth --> m --> Hobbit --> Gorhendad,"Brandybuck, Fearless, Gorhendad, Indomitable, Poetic, Proud, Quiet, The, Waters"
Middle Earth --> m --> Hobbit --> Gormadoc,"Bear, Brandybuck, Enlightened, Gormadoc, Path, Smiling, Stone, The"
Middle Earth --> m --> Hobbit --> Griffo,"Boffin, Feather, Griffo, Honorable, Resilient, Swift"
Middle Earth --> m --> Hobbit --> Gruffo,"Boffin, Dream, Gruffo, Heart, Kind, Mighty, Moon, Mountain, Rising, Strong, Thunderbird, Wise"
Middle Earth --> m --> Hobbit --> Gundabald,"Bear, Bison, Bolger, Brave, Cedar, Courageous, Feathered, Fox, Graceful, Gundabald, Illuminated, Mountain, Proud, Quiet, Serene, Song, Spirit, Stone, Tree, Whisper"
Middle Earth --> m --> Hobbit --> Gundahad,"Bolger, Fair, Fox, Gundahad, Quiet"
Middle Earth --> m --> Hobbit --> Gundahar,"Bolger, Brave, Breeze, Brook, Eagle, Gentle, Gundahar, Running, Sunflower"
Middle Earth --> m --> Hobbit --> Gundolpho,"Bolger, Gundolpho, Mountain, Spirit, Valiant"
Middle Earth --> m --> Hobbit --> Halfast,"Bear, Deer, Fierce, Gamgee, Halfast, Magnificent, River, Running, Stone, Swift, The, Victorious"
Middle Earth --> m --> Hobbit --> Halfred,"Autumn, Brave, Cruel, Dancing, Empowered, Enigmatic, Enlightened, Flame, Gamgee, Greenhand, Halfred, Illustrious, Laughing, Rainbow, Regal, Spirited, Sun, The, Unyielding, Victorious, Willow, Wise"
Middle Earth --> m --> Hobbit --> Hamfast,"Autumn, Bear, Charismatic, Compassionate, Gamgee, Gamwich, Gardner, Hamfast, Intrepid, Little, Otter, Revered, Running, Sky, Spirit, The, Tranquil, Unyielding, Wandering, of"
Middle Earth --> m --> Hobbit --> Hamson,"Fair, Gamgee, Gentle, Hamson, Passionate, Poetic, Revered, Spirit, The"
Middle Earth --> m --> Hobbit --> Harding,"Harding, Hill, of, the"
Middle Earth --> m --> Hobbit --> Hending,"Chivalrous, Conscientious, Eagle, Empowered, Golden, Hending, Moon, Revered, Rising, Strong, Sunflower, The"
Middle Earth --> m --> Hobbit --> Heribald,"Bolger, Brook, Daring, Heribald, Moon, Running, Saint, Silent, Splendid, Tenacious, Terrible, The"
Middle Earth --> m --> Hobbit --> Herugar,"Bolger, Herugar, Majestic, Resolute, The, Valiant"
Middle Earth --> m --> Hobbit --> Hildibrand,"Courageous, Current, Dauntless, Falling, Hildibrand, Mist, Moonlight, Morning, Radiant, Rain, Resolute, Shadow, Swift, The, Took"
Middle Earth --> m --> Hobbit --> Hildifons,"Canyon, Fox, Hildifons, Quiet, Sunlit, Took"
Middle Earth --> m --> Hobbit --> Hildigrim,"Daring, Hildigrim, Just, Precious, Running, Serene, Skilled, Thunder, Took"
Middle Earth --> m --> Hobbit --> Hob,"Blaze, Bold, Dreamer, Eloquent, Fair, Falling, Feathered, Gammidge, Glorious, Hayward, Hob, Indomitable, Ingenious, Leaves, Legendary, Majestic, Ornate, Outspoken, Pine, Resilient, Swift, The, Whispering, Wind"
Middle Earth --> m --> Hobbit --> Hobson,"Conqueror, Gamgee, Gentle, Hobson, Magnanimous, River, Sublime, Swift"
Middle Earth --> m --> Hobbit --> Holfast,"Brave, Dancing, Eagle, Fire, Gardner, Holfast, Indomitable, The"
Middle Earth --> m --> Hobbit --> Holman,"Bison, Brave, Brilliant, Charismatic, Cotton, Cruel, Dawn, Fearless, Great, Greenhand, Holman, Majestic, Peaceful, Quiet, Storm, The, Valiant"
Middle Earth --> m --> Hobbit --> Hugo,"Adroit, Bear, Boffin, Bracegirdle, Brave, Brook, Conscientious, Cruel, Dancing, Deer, Fearless, Fire, Hugo, Imposing, Lionheart, Noble, Regal, Rising, Running, Stone, The, Valiant, Willow"
Middle Earth --> m --> Hobbit --> Ilberic,"Adroit, Brandybuck, Chivalrous, Ilberic, Kind, River, Swift, The, Victorious"
Middle Earth --> m --> Hobbit --> Isembard,"Falcon, Isembard, Little, Regal, Terrible, The, Took"
Middle Earth --> m --> Hobbit --> Isembold,"Dauntless, Formidable, Isembold, Laughing, Red, Resilient, Running, Stoic, Sun, Swift, Terrible, The, Took, Waters, Wind, Wolf"
Middle Earth --> m --> Hobbit --> Isengar,"Bear, Cruel, Doe, Eagle, Feather, Forest, Graceful, Isengar, Jubilant, Radiant, Silent, Stone, Took, Transcendent, Unyielding, Virtuous"
Middle Earth --> m --> Hobbit --> Isengrim,"Adroit, Bear, Compassionate, Dauntless, Eloquent, I, II, III, Imposing, Ingenious, Invincible, Isengrim, Outspoken, River, Smiling, Sublime, Swift, Terrible, The, Took, Visionary"
Middle Earth --> m --> Hobbit --> Isumbras,"Arrow, Artful, Audacious, Benevolent, Brilliant, Cedar, Enigmatic, Falls, Fierce, Gentle, Harbor, Harmonious, Hawk, I, II, III, IV, Isumbras, Lark, Majestic, Morning, Noble, Peaceful, River, Running, Singing, Soaring, Spirit, Star, Strong, Swift, The, Thundering, Took, Transcendent, Tree, Victorious, Wandering, Wolf"
Middle Earth --> m --> Hobbit --> Jago,"Boffin, Brave, Cruel, Dauntless, Eagle, Fearless, Formidable, Jago, Magnificent, Oak, Ornate, River, Singing, Spirited, Strong, The, Tranquil"
Middle Earth --> m --> Hobbit --> Largo,"Baggins, Hawk, Largo, Little, Magnificent, Otter, Quiet, Saint, Singing, The, Waters"
Middle Earth --> m --> Hobbit --> Longo,"Baggins, Breeze, Deer, Gentle, Longo, Running, Sublime"
Middle Earth --> m --> Hobbit --> Lotho,"Conscientious, Dreamer, Feathered, Gentle, Lotho, Sackville-Baggins, Spirit, Tranquil"
Middle Earth --> m --> Hobbit --> Madoc,"Brandybuck, Compassionate, Conqueror, Fair, Fearless, Fire, Illustrious, Madoc, Rising, The"
Middle Earth --> m --> Hobbit --> Marcho,"Deer, Falling, Lake, Marcho, Noble, Running, Serene, Snow, Wise"
Middle Earth --> m --> Hobbit --> Marmadas,"Brandybuck, Marmadas, Mist, Morning, Pious, Sublime, The"
Middle Earth --> m --> Hobbit --> Marmadoc,"Brandybuck, Canyon, Falcon, Great, Harmonious, Little, Marmadoc, Mesa, Sacred, Sunlit, The"
Middle Earth --> m --> Hobbit --> Marroc,"Benevolent, Brandybuck, Empowered, Heroic, Marroc, Stoic, The, Unyielding"
Middle Earth --> m --> Hobbit --> Meriadoc,"Brandybuck, Dream, Eloquent, Gentle, Meriadoc, Mountain, Precious, Spirit, The, Victorious"
Middle Earth --> m --> Hobbit --> Merimac,"Brandybuck, Harmonious, Merimac, Radiant, The"
Middle Earth --> m --> Hobbit --> Merimas,"Brandybuck, Brilliant, Merimas, Owl, Spirited, The, Whispering"
Middle Earth --> m --> Hobbit --> Merry,"Dancing, Fire, Forest, Gardner, Great, Merry, Sagacious, Silent, The"
Middle Earth --> m --> Hobbit --> Milo,"Brave, Burrows, Hawk, Milo, Moonlight, Outspoken, Shadow, Singing, The"
Middle Earth --> m --> Hobbit --> Minto,"Arrow, Benevolent, Burrows, Echo, Falls, Minto, Silent, Skilled, Swift, Thundering"
Middle Earth --> m --> Hobbit --> Moro,"Benevolent, Burrows, Exalted, Harmonious, Honorable, Moro, The"
Middle Earth --> m --> Hobbit --> Mosco,"Burrows, Intrepid, Luminous, Mosco, The, Transcendent"
Middle Earth --> m --> Hobbit --> Mungo,"Baggins, Gracious, Indomitable, Legendary, Mungo"
Middle Earth --> m --> Hobbit --> Nob,"Conscientious, Formidable, Heart, Nob, Running, Sovereign, Spirited, Strong, The, Thunder, Thunderbird, Visionary"
Middle Earth --> m --> Hobbit --> Odo,"Audacious, Distinguished, Fair, Glorious, Heart, Heroic, Majestic, Moonlight, Odo, Proudfoot, Radiant, Regal, Shadow, Strong, The, Unyielding"
Middle Earth --> m --> Hobbit --> Odovacar,"Bolger, Odovacar"
Middle Earth --> m --> Hobbit --> Olo,"Fearless, Feathered, Gentle, Graceful, Gracious, Honorable, Moonlight, Olo, Proudfoot, Shadow, Song"
Middle Earth --> m --> Hobbit --> Orgulas,"Brandybuck, Fearless, Orgulas"
Middle Earth --> m --> Hobbit --> Otho,"Bison, Brave, Brilliant, Conscientious, Cruel, Fair, Gentle, Glow, Luminous, Meadow, Morning, Otho, Quiet, Sackville-Baggins, Sublime, Sunlit, The, Waters"
Middle Earth --> m --> Hobbit --> Otto,"Autumn, Boffin, Falling, Fearless, Hawk, Leaves, Mighty, Otto, Owl, Perceptive, Pious, Poetic, Rain, Serene, Singing, The, Visionary, Whisper, Whispering"
Middle Earth --> m --> Hobbit --> Paladin,"Bold, Breeze, Doe, Empowered, Gentle, Graceful, Harbor, Harmonious, I, II, Just, Lionheart, Majestic, Noble, Ornate, Paladin, Peaceful, Pine, Running, Splendid, The, Thunder, Took, Whispering"
Middle Earth --> m --> Hobbit --> Peregrin,"Cedar, Graceful, Invincible, Laughing, Mesa, Peregrin, Sacred, Singing, The, Thunder, Took, Transcendent, Tree, Waters"
Middle Earth --> m --> Hobbit --> Pippin,"Formidable, Gardner, Intrepid, Pippin, Running, The, Thunder, Victorious"
Middle Earth --> m --> Hobbit --> Polo,"Baggins, Charismatic, Noble, Polo, The, Valiant, Victorious, Zealous"
